{
  "agent_config_sha256": "03bc0139f8a7ef974bdf3ebac85d446acd538ede919cdc99e3813c653304dd88",
  "agent_id": "019feea8-fe32-7073-8ae0-eb54ec9cae24",
  "attempt": 3,
  "capture_method": "codex_tool_result",
  "completed_at": "2026-08-11T02:33:42.679Z",
  "created_at": "2026-08-11T02:33:42.679Z",
  "host_receipt": null,
  "missing_metadata": [
    "model",
    "token_usage"
  ],
  "model": null,
  "model_reasoning_effort": "high",
  "raw_response_path": "stages/s02-metrics/attempt-3/raw-response.txt",
  "raw_response_sha256": "8ad6792a05b7990e12bd07061584c4e092436f4c205dff07025a1ba18124e0d4",
  "receipt_id": "agent_receipt-cdc9150fa8d84391",
  "role": "growth-metrics",
  "run_id": "native-agent-bmr-20260809",
  "schema_version": "1.2",
  "stage_id": "s02-metrics",
  "stage_json_path": "stages/s02-metrics/attempt-3/stage.json",
  "stage_json_sha256": "e1a21d9d4df9f0b9822ec9e52e729d1f7c677a1c5823a70326f9c27932eafe0d",
  "stage_semantic_sha256": "6a4bed931ace9247353f7110e812af9df87370c8fc53107744935dffe627437e",
  "started_at": "2026-08-11T02:31:02.038Z",
  "token_usage": {
    "input_tokens": null,
    "output_tokens": null,
    "total_tokens": null
  },
  "trust_level": "host_observed"
}
